<?xml version="1.0" encoding="UTF-8"?>
<BugHistory xmlns:xsi="http://www.w3.org/2001/XMLSchema-instance"
            xsi:noNamespaceSchemaLocation="scripts/schemas/BUG_HISTORY.xsd">

    <Title>ZXFoundation bug history</Title>
    <LastUpdated>2026-07-28</LastUpdated>

    <BugList>

        <Bug id="BUG-001">
            <FoundDate>2026-07-14</FoundDate>
            <Severity>High</Severity>
            <Description>
                Recursive fault on system check (critical or lower) due to poor DIAG X'288' hercules patch
            </Description>
            <Behavior>
                If any subsystem of the kernel triggers a system check (critical or lower), kernel will recursively
                fault with Operation Exception, and/or trigger a restart (due to misconfigured timebomb)
            </Behavior>
            <Solution>
                Patches Hercules DIAG X'288' Patch to be more robust (also mirror linux)
            </Solution>
            <AffectedBuilds>
                <Range>
                    <From>
                        <Branch>26h2</Branch>
                        <Number>1510</Number>
                    </From>
                    <To>
                        <Branch>26h2</Branch>
                        <Number>1643</Number>
                    </To>
                </Range>
            </AffectedBuilds>
            <Status>Closed</Status>
            <FixedIn>
                <Branch>26h2</Branch>
                <Number>1645</Number>
            </FixedIn>
        </Bug>

        <Bug id="BUG-002">
            <FoundDate>2026-07-19</FoundDate>
            <Severity>Critical</Severity>
            <Description>
                IRQ descriptor table slot-number allocation mismatch causes
                all SCOMS-managed IRQ dispatch to silently fail, posting no
                handlers for any external interrupt (clock comparator, CPU
                timer, IPI, etc.)
            </Description>
            <Behavior>
                register() called g_irq_table.alloc() which pulled an
                arbitrary free-list slot index S, populating m_slots[S] with
                the handler.  irq_dispatch() and find_raw() look up slots by
                the IRQ vector number V (so m_slots[V]), which remained with
                ko.id == KOBJECT_ID_INVALID.  The lookup returned nullptr and
                the handler was never invoked.

                Consequence: ext.cxxm routed every external interrupt through
                the IRQ table (instead of direct fast paths), so clock
                comparator events, CPU timer ticks, timing alerts, service
                signals, and IPI vectors all produced zero dispatch work.
                Without timer-driven scheduler ticks the BSP stopped advancing,
                and APs entering sched_init_ap simultaneously raced raw PMM
                allocations with no scheduler heartbeat, yielding
                nondeterministic PMM free-list corruption (assert_allocatable_frame
                with frame_owner::stack, order 2), deadlocks (254/255 progress
                stall), or undefined spin-wait hangs.
            </Behavior>
            <Solution>
                Introduced scoms_table::alloc_at(u32 id) which claims a
                specific slot index by unlinking it from the SCOMS free-list
                rather than taking an arbitrary slot from the free-list head.
                irqdesc::register() now calls alloc_at(irq) so the
                irq_desc for vector V always occupies m_slots[V], making
                find_raw(V) reach the correct descriptor.

                Additional benefit: alloc_at() is robust against reuse of a
                slot by a different IRQ vector — if m_slots[id].ko.id !=
                KOBJECT_ID_INVALID, the call returns already_locked, which
                replaces the silent double-registration that existed before.
            </Solution>
            <AffectedBuilds>
                <Range>
                    <From>
                        <Branch>26h2</Branch>
                        <Number>1646</Number>
                    </From>
                    <To>
                        <Branch>26h2</Branch>
                        <Number>1654</Number>
                    </To>
                </Range>
            </AffectedBuilds>
            <Status>Closed</Status>
            <FixedIn>
                <Branch>26h2</Branch>
                <Number>1655</Number>
            </FixedIn>
        </Bug>

        <Bug id="BUG-003">
            <FoundDate>2026-07-26</FoundDate>
            <Severity>High</Severity>
            <Description>
                __schedule early-return path leaves the re-picked strand with
                substate==runnable instead of substate==running.
            </Description>
            <Behavior>
                In sched::schedule() the prev strand is enqueued (or kept
                runnable) at L423-L437 — its substate is set to
                sched_substate::runnable.  When select_next() then picks the
                same strand again (next == prev), the function takes the
                early-return branch (L477-L481) and skips the
                next->substate = sched_substate::running transition at
                L494.

                Consequence: any strand that yields and is immediately
                re-picked retains substate==runnable even though it IS the
                running strand.  This was exposed by dom_op::strand_query_state
                (user/init/init.S Test 57) which read the primary strand's
                substate from inside a running SVC handler and observed
                substate==1 (runnable) instead of substate==2 (running).
                Beyond the test failure, the bug silently corrupts any
                scheduler introspection or migration logic that consults
                strand.substate on the running strand to decide whether the
                CPU is currently committed.
            </Behavior>
            <Solution>
                Set next->substate = sched_substate::running before the
                early-return from the next==prev branch in __schedule.
                This is the same transition the long-form handoff path
                performs at L494; the early-return was simply missing it.
            </Solution>
            <AffectedBuilds>
                <Range>
                    <From>
                        <Branch>26h2</Branch>
                        <Number>1700</Number>
                    </From>
                    <To>
                        <Branch>26h2</Branch>
                        <Number>1878</Number>
                    </To>
                </Range>
            </AffectedBuilds>
            <Status>Closed</Status>
            <FixedIn>
                <Branch>26h2</Branch>
                <Number>1879</Number>
            </FixedIn>
        </Bug>

        <Bug id="BUG-005">
            <FoundDate>2026-07-28</FoundDate>
            <Severity>High</Severity>
            <Description>
                cap::acquire syscall retained the removed forgeable type/id ABI
                instead of accepting a nucleus-issued source capability token
            </Description>
            <Behavior>
                user/init passed cap_type, domain id, and requested rights to
                cap::acquire. The nucleus interpreted the first argument as an
                opaque token, so the reconstructed value failed capability-slot
                generation and ownership validation.
            </Behavior>
            <Solution>
                Bootstrap now supplies an all-rights nucleus-issued source token
                through the preserved init ABI register. cap::acquire derives
                only from that token, while the init tests use the opaque token
                for admin, map, and delegate derivation.
            </Solution>
            <AffectedBuilds>
                <Range>
                    <From>
                        <Branch>26h2</Branch>
                        <Number>1???</Number>
                    </From>
                    <To>
                        <Branch>26h2</Branch>
                        <Number>1992</Number>
                    </To>
                </Range>
            </AffectedBuilds>
            <Status>Closed</Status>
            <FixedIn>
                <Branch>26h2</Branch>
                <Number>1993</Number>
            </FixedIn>
        </Bug>

        <Bug id="BUG-006">
            <FoundDate>2026-07-28</FoundDate>
            <Severity>High</Severity>
            <Description>
                Domain names retained temporary user-buffer pointers and
                secondary strands retained SCOMS parent dependencies during teardown
            </Description>
            <Behavior>
                The domain-create syscall passed a stack-local copied name to
                domain_create(), leaving domain::name dangling. Later teardown
                logs printed empty or corrupted names. Domain destruction also
                released secondary strand slots without detaching them from the
                domain, so the final domain release could fail with live dependents.
            </Behavior>
            <Solution>
                Domains now own a bounded inline name buffer and copy names into
                it during creation. Secondary strand teardown detaches each
                strand from its domain before releasing its SCOMS slot.
            </Solution>
            <AffectedBuilds>
                <Range>
                    <From>
                        <Branch>26h2</Branch>
                        <Number>1???</Number>
                    </From>
                    <To>
                        <Branch>26h2</Branch>
                        <Number>1993</Number>
                    </To>
                </Range>
            </AffectedBuilds>
            <Status>Closed</Status>